{
  "apiVersion": "aide.disked-projection/v1",
  "kind": "WorkUnit",
  "metadata": {
    "id": "DE-W043",
    "createdAt": "2026-10-12T02:06:04.615544+00:00",
    "sourcePath": "spec/work/units.json",
    "producer": {
      "name": "disked-specctl",
      "version": "0.1.91-proposed.1"
    },
    "compatibility": {
      "schemaVersion": "1",
      "protocolVersion": "1",
      "minReaderVersion": "1",
      "minWriterVersion": "1",
      "featureFlags": [
        "disked-non-authorizing-projection"
      ]
    }
  },
  "spec": {
    "task_id": "DE-W043",
    "title": "Implement separately admitted image-only formatting",
    "work_type": "build",
    "authorizes_implementation": false,
    "check_only": false,
    "acceptance_review": false,
    "implementation_scope": "See spec/work/units.json for exact outputs. Separate grant required.",
    "stop_state": "needs_review",
    "predecessors": [
      "DE-W042"
    ],
    "dependencies": [
      "DE-DEC-004"
    ],
    "scope": {
      "allowed_paths": [
        "source/providers/image/**",
        "source/runtime/planner/**",
        "tests/images/**",
        "tests/interruption/**"
      ],
      "forbidden_paths": [
        "customer-data/**",
        "secrets/**",
        "signing-keys/**",
        ".git/**"
      ],
      "forbidden_operations": [
        "raw physical-device access",
        "administrator/root execution",
        "customer-data access",
        "release signing",
        "unrequested GitHub mutation",
        "automatic protected-branch promotion",
        "executing fetched scripts",
        "claiming unrun tests passed"
      ],
      "read_only_review_paths": [
        "spec/**"
      ]
    },
    "validation": {
      "commands": [
        {
          "command": "python spec/tools/specctl.py check",
          "status": "NOT_RUN"
        },
        {
          "command": "python -m unittest discover -s spec/tools/tests -v",
          "status": "NOT_RUN"
        }
      ]
    },
    "evidence_requirements": [
      "No physical-device handles or unsupported option substitution.",
      "Interruption/discard/loss/consumer-compatibility cases covered; no format-as-sanitize claim."
    ],
    "explicit_non_capabilities": [
      "physical_device_access",
      "elevation",
      "release_signing",
      "automatic_promotion",
      "execution_authority"
    ]
  },
  "status": {
    "phase": "planned",
    "result": "NOT_RUN",
    "validated": false,
    "validation_errors": [],
    "validation_warnings": [
      "Projection shape checked locally; full pinned AIDE runtime/CLI integration not executed."
    ]
  }
}
